support_the_meiji_desc;The Japanese knew they were behind the Western powers when US Commodore Matthew C. Perry came to Japan in 1853 in large warships with armaments and technology that far outclassed those of Japan with the intent to conclude a treaty that would open up japanese ports to trade.\n Figures like Shimazu Nariakira concluded that 'if we take the initiative, we can dominate, if we do not, we will be dominated', leading Japan to 'throw open its doors' to foreign technology.;;;;Los japoneses sabían que estaban detrás de las potencias occidentales cuando el comodoro estadounidense Matthew C. Perry llegó a Japón en 1853 en grandes buques de guerra con armamento y tecnología que superaban con creces a los de Japón con la intención de concluir un tratado que abriera los puertos japoneses al comercio.\n Figuras como Shimazu Nariakira concluyeron que 'si tomamos la iniciativa podemos dominar, si no lo hacemos, seremos dominados', lo que llevó a Japón a 'derrivar sus puertas' a favor de la tecnología.;;;;;;;;x
support_from_england_title;Tech support from England;;;;Suporte tecnológico de Inglaterra;;;;;;;;x
support_from_england_desc;During the turbulent history prior to the Meiji Restoration, the British showed interest in the situation, while seeking to protect their interests and property in the region. For this reason, the United Kingdom provided materials, technology and knowledge to the imperial side.;;;;Durante la turbulenta historia previa a la Restauración Meiji, los britanicos mostraban interes en la situacion, a la vez que buscaban proteger sus intereses y propiedades en la region. Por tal motivio, Reino Unido proveía de materiales, tecnologia y conocimientos al bando imperial.;;;;;;;;x
support_the_emperor_title;Support the Emperor;;;;Apoyar al Emperador;;;;;;;;x
support_the_emperor_desc;Although the Japanese island is ruled by an emperor, the true ruler is the Tokugawa shogun.\n The shogunate uses its power to control the island and the daimyos, but, thanks to this, peace has been maintained for two centuries.;;;;Aunque la isla japonesa es gobernada por un emperador, el verdadero gobernador de facto es el shogun de Tokugawa.\n El shogunato usa su poder para controlar la isla y los daimyos, aun así, gracias a esto, se ha mantenido la paz durante dos siglos.;;;;;;;;x
trading_companies_title;Trading companies;;;;Compañias de comercio;;;;;;;;x
trading_companies_desc;For years, Western Powers have requested permission to trade in our lands, but the Tokugawa shogunate have restricted these actions, affecting the economy and the variety of materials that we have.\n It is time to decide on our own and create trading companies with those western nations.;;;;Durante años, Potencias occidentales han pedido permiso de comercio en nuestras tierras, pero el shogunato Tokugawa han restringido estas acciones, afectando las economia y la variedad de materiales con las que disponemos.\n Es hora de decidir por nuestra cuenta y crear compañias de comercio con esas naciones occidentales.;;;;;;;;x
social_develop_title;Social Development;;;;Desarrollo social;;;;;;;;x
social_develop_desc;The development of society must be a priority if we want a strong and stable nation.\n If society supports our government, it will also support us when we declare war.;;;;El desarrollo de la sociedad debe ser una prioridad si queremos una nación fuerte y estable.\n Si la sociedad apoya a nuestro gobierno, también nos apoyará cuando declaremos la guerra.;;;;;;;;x
exploration_mission_title;Exploration Mission;;;;Misión de exploración;;;;;;;;x
exploration_mission_desc;The tokugawa clan refuses to leave the island, for them, anything that comes from outside is bad and they think that we have enough resources within our borders. We must carry out an expedition in search of unique resources that we cannot find on the island and thus prove how wrong they are.;;;;El clan tokugawa se niega a salir de la isla, para ellos, todo lo que venga de fuera es malo y creen que tenemos suficientes recursos dentro de nuestras fronteras. Debemos realizar una expedición en busca de recursos únicos que no podemos encontrar en la isla y así demostrar lo equivocados que están.;;;;;;;;x
the_main_daymio_ryu_title;The main daimyo;;;;El Daimyo principal;;;;;;;;x
the_main_daymio_ryu_desc;The heads of the clans have shown loyalty to the emperor and organize to decide how to act against Tokugawa, even so, it remains to decide who will be the central axis of the alliance.\n A good way to decide this will be by showing which is the most powerful daimyo.;;;;Los jefes de los clanes han mostrado lealtad al emperador y se organizan para decidir cómo actuar contra Tokugawa, aún así, queda por decidir quién será el eje central de la alianza.\n Una buena forma de decidir esto será mostrando cuál es el daimyo más poderoso.;;;;;;;;x
the_main_daymio_mou_title;The main daimyo;;;;El Daimyo principal;;;;;;;;x
the_main_daymio_mou_desc;The heads of the clans have shown loyalty to the emperor and organize to decide how to act against Tokugawa, even so, it remains to decide who will be the central axis of the alliance.\n A good way to decide this will be by showing which is the most powerful daimyo.;;;;Los jefes de los clanes han mostrado lealtad al emperador y se organizan para decidir cómo actuar contra Tokugawa, aún así, queda por decidir quién será el eje central de la alianza.\n Una buena forma de decidir esto será mostrando cuál es el daimyo más poderoso.;;;;;;;;x
the_main_daymio_mae_title;The main daimyo;;;;El Daimyo principal;;;;;;;;x
the_main_daymio_mae_desc;The heads of the clans have shown loyalty to the emperor and organize to decide how to act against Tokugawa, even so, it remains to decide who will be the central axis of the alliance.\n A good way to decide this will be by showing which is the most powerful daimyo.;;;;Los jefes de los clanes han mostrado lealtad al emperador y se organizan para decidir cómo actuar contra Tokugawa, aún así, queda por decidir quién será el eje central de la alianza.\n Una buena forma de decidir esto será mostrando cuál es el daimyo más poderoso.;;;;;;;;x
the_main_daymio_dat_title;The main daimyo;;;;El Daimyo principal;;;;;;;;x
the_main_daymio_dat_desc;The heads of the clans have shown loyalty to the emperor and organize to decide how to act against Tokugawa, even so, it remains to decide who will be the central axis of the alliance.\n A good way to decide this will be by showing which is the most powerful daimyo.;;;;Los jefes de los clanes han mostrado lealtad al emperador y se organizan para decidir cómo actuar contra Tokugawa, aún así, queda por decidir quién será el eje central de la alianza.\n Una buena forma de decidir esto será mostrando cuál es el daimyo más poderoso.;;;;;;;;x
liberal_republic_title;A liberal republic;;;;Una república liberal;;;;;;;;x
liberal_republic_desc;Ezo is notable for being the first government to attempt to institute democracy in Japan, though voting was allowed only to the samurai caste. The Republic of Ezo existed for only 5 months.;;;;Ezo se destaca por ser el primer gobierno en intentar instituir la democracia en Japón, aunque solo se permitía votar a la casta samurái. La República de Ezo existió solo durante 5 meses.;;;;;;;;x
trade_with_france_title;Trade with France;;;;Comercio con Francia;;;;;;;;x
trade_with_france_desc;After the defeat of the forces of the Tokugawa shogunate in the Boshin War of the Meiji Restoration, a part of the former shogun's navy led by Admiral Enomoto Takeaki fled to the northern island of Ezo, together with several thousand soldiers and a handful of French military advisers and their leader, Jules Brunet.\n After that, relations between France and Ezo have only increased, reaching military and commercial agreements between both nations.;;;;Después de la derrota de las fuerzas del shogunato Tokugawa en la Guerra Boshin de la Restauración Meiji, una parte de la antigua armada del shogun liderada por el almirante Enomoto Takeaki huyó a la isla norteña de Ezo, junto con varios miles de soldados y un puñado de militares franceses asesores y su líder, Jules Brunet.\n Después de eso, las relaciones entre Francia y Ezo solo se han incrementado, llegando a acuerdos militares y comerciales entre ambas naciones.;;;;;;;;x
USCA_breaking_title;USCA is Breaking;;;;La RFCA está desmoronandose;;;;;;;;x
USCA_breaking_desc;The discomfort of the people through the country is making bigger and bigger and the nationalist feeling is rising.\n To supress this, we get negotiations with United Kingdom, maybe getting Belize makes people feel better.;;;;El malestar de la gente en todo el país se hace cada vez más grande y el sentimiento nacionalista está aumentando.\n Para reprimir esto, entablamos negociaciones con el Reino Unido, quizás conseguir Belice haga que la gente se sienta mejor.;;;;;;;;x
population_boom_title;Population Boom;;;;Boom Poblacional;;;;;;;;x
population_boom_desc;As technology and industry advance, the population acquires a higher liferating, at the same time, the population increases.\n Throughout the world the population has increased due to the advancement of civilization and comfort, and our nation is not out of the way.;;;;A medida que avanzan la tecnología y la industria, la población adquiere una tasa de vida más alta, al mismo tiempo, la población aumenta.\n En todo el mundo la población ha aumentado debido al avance de la civilización y la comodidad, y nuestra nación no se quedará fuera.;;;;;;;;x
Tripoli_won_title;Tripoli Won;;;;Tríplo Ganó;;;;;;;;x
Tripoli_won_desc;An incredible result has been archieved in North Africa, a great power has lost a war against an uncivilized nation, as David versus Goliath.\n Now, the whole world knows about this Tripolitan success, our nation rises in glory and at the same time, the Ottoman Empire lies in the ground, the 'sick man' of Europe is falling.;;;;Se ha obtenido un resultado increíble en el norte de África, una gran potencia ha perdido una guerra contra una nación incivilizada, como David contra Goliat.\n Ahora, el mundo entero conoce este éxito tripolitano, nuestra nación se eleva en gloria y al mismo tiempo, el Imperio Otomano yace en el suelo, el 'enfermo' de Europa está cayendo.;;;;;;;;x
unite_cono_sur_title;Unite Cono Sur Provinces;;;;Unir las Provincias del Cono Sur;;;;;;;;x
unite_cono_sur_desc;The nations which were once part of the Viceroyalty of La Plata must be reunited under a single flag once again, a new and modern nation, the platinean and south andean peoples bound together into a great ntion, a power to rule in the New World.;;;;Las naciones que alguna vez fueron parte del Virreinato de La Plata deben reunirse bajo una sola bandera una vez más, una nación nueva y moderna, los pueblos platineano y sur andino unidos en una gran nación, un poder para gobernar en el Nuevo Mundo.;;;;;;;;x
triple_alianza_war_pre_title;Making a Bigger Paraguay;;;;Hacer un Paraguay más Grande;;;;;;;;x
triple_alianza_war_pre_desc;With the recent territory gained, we are ready to invest to help our people. If we want to be the greatest nation in America we need a big population, so, spending some money in life rating is the best way.;;;;Con el territorio ganado recientemente, estamos dispuestos a invertir para ayudar a nuestra gente. Si queremos ser la nación más grande de América, necesitamos una gran población, por lo que gastar algo de dinero en calificación de vida es la mejor manera.;;;;;;;;x
triple_alianza_war_third_title;Venacio Flores Convention;;;;Convención de Venacio Flores;;;;;;;;x
triple_alianza_war_third_desc;Due to the invasion from Brazil against Uruguay, the Blanco's party had to yield to Brazilian demands, the leader of Colorado's party, Venacio Flores, has taken the presidency of Uruguay and has celebrated a convention to deal with the Paraguayan issue.;;;;Debido a la invasión de Brasil contra Uruguay, el partido Blanco tuvo que ceder a las demandas brasileñas, el líder del partido Colorado, Venacio Flores, ha tomado la presidencia de Uruguay y ha celebrado una convención para tratar el tema paraguayo.;;;;;;;;x
triple_alianza_running_title;Battle of Tuyuti;;;;Batalla de Tuyutí;;;;;;;;x
triple_alianza_running_desc;The war of the Triple Alliance is advancing on a bloody path. Paraguayan forces establish a strong defense in Tuyuti, the cholera-sick Brazilians have infected both, allies and enemies, in the front line, meanwhile, the Bolivian government can take advantage of the situation and regain the territory of the province of Alto.;;;;La guerra de la Triple Alianza avanza por un camino sangriento. Las fuerzas paraguayas establecen una fuerte defensa en Tuyuti, los brasileños enfermos de cólera han infectado tanto aliados como enemigos en la línea del frente, mientras tanto, el gobierno boliviano puede aprovechar la situación y recuperar el territorio de la provincia de Alto.;;;;;;;;x
triple_alianza_end_title;The reconstruction after the war;;;;Reconstrucción despues de la guerra;;;;;;;;x
triple_alianza_end_desc;The war is over but the wound still open, suporting our people ideologies is the best way for now.\n Liberal sentiments are getting stronger marking a new way for the future of the South American governments, but, the war memories and crimes will be always with us.;;;;La guerra terminó pero la herida sigue abierta, apoyar las ideologías de nuestro pueblo es la mejor manera por ahora.\n Los sentimientos liberales se están fortaleciendo marcando un nuevo camino para el futuro de los gobiernos sudamericanos, pero los recuerdos de guerra y los crímenes serán siempre con nosotros.;;;;;;;;x
unite_peru_title;Restore Peru;;;;Restaura el Perú;;;;;;;;x
unite_peru_desc;At the late War of Confederation, Chilean-Peruvian forces of the so-called Restorative Army led by General Manuel Bulnes, obtain a decisive victory in the battle of Yungay in 1839 while Andrés de Santa Cruz had been overthrown from the post of President of Bolivia by general José Miguel de Velasco who betrayed him before knowing the result of the battle. At the same time the general José Ballivián leaving the battlefield and mutinied in La Paz along with Bolivian reserve battalions. Also Colonel Guilarte, who had 700 soldiers in command, had abandoned his position and deserted without firing any shots. This battle caused the dissolution of the Peru-Bolivian Confederation, the exile of Santa Cruz, the restoration of Peru and Bolivia, among other consequences.;;;;Al final de la Guerra de Confederación, las fuerzas chileno-peruanas del llamado Ejército Restaurador lideradas por el general Manuel Bulnes, obtienen una victoria decisiva en la batalla de Yungay en 1839 mientras Andrés de Santa Cruz había sido derrocado del cargo de presidente de Bolivia por el general José Miguel de Velasco quien lo traicionó antes de conocer el resultado de la batalla. Al mismo tiempo, el general José Ballivián abandona el campo de batalla y se amotina en La Paz junto a los batallones de reserva bolivianos. También el coronel Guilarte, que tenía 700 soldados al mando, había abandonado su puesto y desertado sin hacer ningún disparo. Esta batalla provocó la disolución de la Confederación Perú-Bolivia, el exilio de Santa Cruz, la restauración de Perú y Bolivia, entre otras consecuencias.;;;;;;;;x
protect_the_galapagos;Protection of the Galapagos;;;;Protección a las Galapagos;;;;;;;;x
protect_the_galapagos_desc;The Galapagos Islands are a unique place on the planet, where we can study the species and that has been very useful for naturists like Charles Darwin. Therefore, establishing their protection should be a priority for future investigations.;;;;Las Islas Galápagos son un lugar unico en el planeta, donde podemos estudiar las especies y que ha sido de gran utilidad para naturistas como Charles Darwin. Por lo tanto, establecer su protección debe ser prioridad para futuras investigaciones.;;;;;;;;x
texan_legacy_title;The Texan Final Legacy;;;;El Legado Final de los Texanos;;;;;;;;x
texan_legacy_desc;After the appointment of James Polk as president of the United States, his insistence on the territory of Texas has been constant. Polk insists that the Texas territory belongs to the United States by right and has asked the Senate to carry out a military expedition against Mexico, this request has been rejected more than once.\n However, Polk has not given up on his goal of expanding the nation, so he has decided to perform a casus belli on his own. He has sent a military contingent to the city of San Antonio, and dressed in Mexican military uniforms they have murdered local Texans and Americans. After this event, which Mexico has strongly denied that was carried out by its soldiers, even presenting evidence, Polk has declared to the United States Senate: 'the Mexican military has shed American blood' and so, this time, Polk has got approval for the declaration of war.;;;;Tras el nombramiento de James Polk como presidente de los Estados Unidos, la insistencia de este sobre el territorio de Texas ha sido constante. Polk insiste que el territorio texano le pertenece a Estados Unidos por derecho y ha pedido al senado el realizar una expedición militar contra México, esta solicitud ha sido rechazada en más de una vez.\n No obstante, Polk no ha cedido en su objetivo de expandir la nación, por lo que este ha decidido realizar un casus belli por su cuenta. Ha enviado un contingente militar a la ciudad de San Antonio, y vestidos con uniformes militares mexicanos han asesinado ciudadanos texanos y estadounidenses locales. Después de este suceso, el cual México ha negado fuertemente que haya sido realizado por sus soldados, incluso presentando pruebas, Polk ha declarado al senado de los Estados Unidos: ‘los militares mexicanos han derramado sangre estadounidense’ y así, esta vez, Polk ha conseguido la aprobación para la declaración de guerra.;;;;;;;;x
tripolitan_miracle_title;Tripolitan Miracle;;;;El Milagro Tripolitano;;;;;;;;x
tripolitan_miracle_desc;By recovering Tripoli, the academics there have also been freed and now restart their studies.;;;;Al recuperar Trípoli, los académicos allí también se han liberado y ahora reinician sus estudios.;;;;;;;;x
liberate_liberia_title;Liberate Liberia;;;;Liberar Liberia;;;;;;;;x
liberate_liberia_desc;The freed slave colony in Africa is fully functional and self-sufficient, it's time for the promised land to be completely freed.;;;;La colonia de esclavos liberados en África es completamente funcional y autosuficiente, es hora de que la tierra prometida sea completamente libre.;;;;;;;;x
form_indonesia_title;Form Indonesia;;;;Forma Indonesia;;;;;;;;x
form_indonesia_desc;After 3 centuries of Dutch colonialism of the Indonesian islands, the region was invaded by Japan during the WWII, ending with the domain of Netherlands. Due this, the nationalism and independence sentiments of Indoneasia got stronger and finally, after the WWII ends, on 1945, Indonesia declare it's independence.;;;;Después de 3 siglos de colonialismo holandés de las islas de Indonesia, la región fue invadida por Japón durante la Segunda Guerra Mundial, terminando con el dominio de los Países Bajos. Debido a esto, los sentimientos de nacionalismo e independencia de Indonesia se hicieron más fuertes y finalmente, después de que terminó la Segunda Guerra Mundial, en 1945, Indonesia declaró su independencia.;;;;;;;;x
form_yugoslavia_title;Unite Yugoslavia;;;;Une Yugoslavia;;;;;;;;x
form_yugoslavia_desc;After wars and wars and wars between the slavic countries, and the occupation of these by the Great Powers, we are free and we have the dream to unite all slavic people under one flag. United we will finally get the respect of Europe and the land that belongs to us by law, this is the born of Yugoslavia;;;;Después de guerras y guerras y más guerras entre los países eslavos, y la ocupación de estos por las grandes potencias, somos libres y tenemos el sueño de unir a todos los pueblos eslavos bajo una bandera. Unidos finalmente conseguiremos el respeto de Europa y la tierra que nos pertenece por derecho, esto es el nacido de Yugoslavia.;;;;;;;;x
unite_iberia_title;Unite Iberia;;;;Une Iberia;;;;;;;;x
unite_iberia_desc;The Iberian Union was the dynastic union of the Kingdom of Spain and the Kingdom of Portugal under the Spanish Crown that existed between 1580 and 1640, and which brought the entire Iberian Peninsula, as well as Portuguese overseas possessions, under the Spanish Habsburg kings.\n The union began following the Portuguese crisis of succession and the ensuing War of the Portuguese Succession, and lasted until the Portuguese Restoration War in which the House of Braganza was established as Portugal's new ruling dynasty.;;;;La Unión Ibérica fue la unión dinástica del Reino de España y el Reino de Portugal bajo la Corona española que existió entre 1580 y 1640, y que trajo toda la Península Ibérica, así como las posesiones portuguesas de ultramar, bajo los reyes Habsburgo españoles.\n La unión comenzó tras la crisis de sucesión portuguesa y la consiguiente Guerra de Sucesión portuguesa, y duró hasta la Guerra de Restauración portuguesa en la que se estableció la Casa de Braganza como la nueva dinastía gobernante de Portugal.;;;;;;;;x
unite_baltic_pro_title;Unite the Baltic Provinces;;;;Unir las Provincias Bálticas;;;;;;;;x
unite_baltic_pro_desc;The United Baltic Duchy, also known as the Grand Duchy of Livonia, was a state proposed by the Baltic German nobility and exiled Russian nobility after the Russian Revolution and German occupation of the Courland, Livonian, and Estonian governorates of the Russian Empire. It was proposed in April 1918, after Estonia and Latvia had formally declared independence.\n The idea comprised the lands in Estonia and Latvia and included the creation of a Duchy of Courland and Semigallia and a Duchy of Estonia and Livonia that would be in personal union with the Crown of Prussia under the German Empire's occupied territory before the end of World War I covering the territories of the Medieval Livonia in what are now Latvia and Estonia.;;;;El Ducado Unido del Báltico, también conocido como el Gran Ducado de Livonia, fue un estado propuesto por la nobleza alemana del Báltico y la nobleza rusa exiliada después de la Revolución Rusa y la ocupación alemana de las gobernaciones de Curlandia, Livonia y Estonia del Imperio Ruso.\n Se propuso en abril de 1918, después de que Estonia y Letonia declararan formalmente su independencia.\n La idea comprendía las tierras de Estonia y Letonia e incluía la creación de un Ducado de Curlandia y Semigallia y un Ducado de Estonia y Livonia que sería unión personal con la Corona de Prusia bajo el territorio ocupado por el Imperio Alemán antes del final de la Primera Guerra Mundial cubriendo los territorios de la Livonia medieval en lo que ahora son Letonia y Estonia.;;;;;;;;x
unite_poland_lit_title;Form Poland-Lithuania;;;;Forma Polonia-Lituania;;;;;;;;x
unite_poland_lit_desc;The Polish–Lithuanian Commonwealth, was a country and bi-federation of Poland and Lithuania ruled by a common monarch in real union, who was both King of Poland and Grand Duke of Lithuania.\n It was one of the largest and most populous countries of  Europe between the 16th and 17th centuries. At its largest territorial extent, in the early 17th century, the Commonwealth covered almost 1,000,000 square kilometres and as of 1618 sustained a multi-ethnic population of almost 12 million. Polish and Latin were the two co-official languages.;;;;La Mancomunidad de Polonia-Lituania, era un país y bi-federación de Polonia y Lituania gobernados por un monarca común en unión real, que era a la vez rey de Polonia y Gran Duque de Lituania.\n Fue uno de los países más grandes y más pobladas de Europa entre los siglos XVI y XVII. En su mayor extensión territorial, a principios del siglo XVII, la Mancomunidad cubría casi 1.000.000 de kilómetros cuadrados y en 1618 sostenía una población multiétnica de casi 12 millones. El polaco y el latín eran los dos idiomas co-oficiales.;;;;;;;;x
anex_to_poland_player_title;Unite to Poland;;;;Unirse a Polonia;;;;;;;;x
anex_to_poland_player_desc;As a free city and remnant of the Duchy of Warsaw, and now with the existence of Poland, the idea of uniting with the rest of the country to which we culturally belong is the best option we can take.;;;;Como ciudad libre y remanente del Ducado de Varsovia, y ahora con la existencia de Polonia, la idea de unirnos con el resto del país al que culturalmente pertenecemos es la mejor opción que podemos tomar.;;;;;;;;x
anex_to_poland_pol_title;Annex Krakow;;;;Anexar Cracovia;;;;;;;;x
anex_to_poland_pol_desc;With the reinstated Republic of Poland, we must begin to recover the Polish peoples that are outside our borders, the first step will be the annexation of the free city of Krakow, with which we have very good relations and who have voluntarily asked us to join.;;;;Con la reinstalación de la República de Polonia, debemos comenzar a recuperar a los pueblos polacos que se encuentran fuera de nuestras fronteras, el primer paso será la anexión de la ciudad libre de Cracovia, con la que tenemos muy buenas relaciones y que voluntariamente nos han pedido sumarlos.;;;;;;;;x
unite_czechos_title;Unite Czechoslovakia;;;;Une Checoslovaquia;;;;;;;;x
