EVTDESC52;The Arab Desert region is an unexplored area with difficult climates and terrain, inhabited by nomads and tribes.\n Now, we have a group of explorers ready to leave, they only need money for supplies, although it depends on how much money the national budget has.\n This is a great opportunity for our nation to expand its borders since neighboring countries also have an interest in the region. We can make the decision to send them right now and get advantage or wait for a healthier economical moment.Neither is it necessary to expand our nation even more, we have more important business to do at this time;;;;La región del desierto árabe es una zona inexplorada con climas y terrenos difíciles, habitada por nómadas y tribus.\n Ahora tenemos un grupo de exploradores listos para partir, solo necesitan dinero para suministros, aunque depende de cuánto dinero tengamos en nuestro presupuesto nacional.\n Esta es una gran oportunidad para que nuestra nación expanda sus fronteras ya que los países vecinos también tienen interés en la región. Podemos tomar la decisión de enviarlos ahora mismo y sacar ventaja o esperar un momento económico más saludable.;;;;;;;;x
EVTOPTA52;Send explorer now;;;;Enviar exploradores ahora;;;;;;;;x
EVTOPTB52;Maybe later;;;;Mejor después;;;;;;;;x
EVTNAME53;We need to send more colonists;;;;Necesitamos enviar mas colonos;;;;;;;;x
EVTDESC53;Our explorers in the Nejd Desert report that other nations have established settlements in the region, one of those is a Great Power. It is possible that they establish cities before us so we must make a decision.\n We can send twice as many settlers to the region and expect that those countries leave, although we could get in trouble with them.;;;;Nuestros exploradores en el Desierto del Nejd informan que otras naciones han establecido asentamientos en la región, una de ellas es una Gran Potencia. Es posible que establezcan ciudades antes que nosotros, así que debemos tomar una decisión.\n Podemos enviar el doble de colonos a la región y esperar que esos países se vayan, aunque podríamos tener problemas con ellos.;;;;;;;;x
EVTOPTA53;Send twice as many new groups of settlers;;;;Enviar el doble de colonizadores;;;;;;;;x
EVTOPTB53;There's no need to hurry, let's decide later;;;;No hay necesidad de apurarse, decidamos más tarde;;;;;;;;x
EVTOPTC53;Withdraw and avoid problems.;;;;Retirarse y evitar problemas;;;;;;;;x
EVTNAME54;Success in Nejd;;;;Éxito en Nejd;;;;;;;;x
EVTDESC54;The settlement has been a success, now it is a functional and safe city for our people. The new region is going to be incorporated into our country.\n \n           Glory to our nation;;;;El asentamiento ha sido un éxito, ahora es una ciudad funcional y segura para nuestra gente. La nueva región se incorporará a nuestro país.\n \n         Gloria a nuestra nación;;;;;;;;x
EVTOPTA54;Glory to our nation!;;;;¡Gloria a nuestra nación!;;;;;;;;x
EVTNAME55;The country is falling apart;;;;El país se desmorona.;;;;;;;;x
EVTDESC55;The recent crisis is leaving a state of anarchy and desperation, the people is dying, fighting between them and they want your head. Now, my leader, you need to form a personal army and defend your position against your people but you need to keep happy the upper house and aristocrats or they may betray you.\n Take off the people goods and escape until the crisis ends.;;;;La reciente crisis está dejando un estado de anarquía y desesperación, la gente está muriendo, luchando entre ellos y ahora quieren tu cabeza.\n Ahora, mi líder, debe formar un ejército personal y defender su posición contra su gente, pero debe mantener contentos a la cámara alta y los aristócratas o pueden traicionarlo.\n Quitale los bienes de la gente y escondete hasta que termine la crisis.;;;;;;;;x
EVTOPTA55;Take all you can and leave;;;;Tomar todo lo que se pueda y huir;;;;;;;;x
EVTNAME56;Independence Sentiments;;;;Sentimientos de Independencia;;;;;;;;x
EVTDESC56;The people are asking for independence, we cannot pretend that we are deaf and blind, we must make a decision before a revolution starts.;;;;La gente pide independencia, no podemos fingir que somos sordos y ciegos, debemos tomar una decisión antes de que comience una revolución.;;;;;;;;x
EVTOPTA56;We want independence;;;;Queremos independencia;;;;;;;;x
EVTOPTB56;We need the protection from our Overlord;;;;Necesitamos la protección de nuestro Señor;;;;;;;;x
EVTNAME57;The End of the Confederation;;;;El Final de la Confederación;;;;;;;;x
EVTDESC57;Once the war ended and our president was exiled, we have no choice but to dismantle the confederation and give rise to the Republic of Bolivia.;;;;Una vez que terminó la guerra y nuestro presidente fue exiliado, no nos queda más remedio que desmantelar la confederación y dar lugar a la República de Bolivia.;;;;;;;;x
EVTOPTA57;Dismantle the confederation;;;;Disolver la confederación;;;;;;;;x
EVTNAME58;La Liga Filipina;La Liga Filipina;La Liga Filipina;;La Liga Filipina;;;;;;;;x
EVTDESC58;La Liga Filipina was a secret organization. It was founded by José Rizal in the house of Doroteo Ongjunco at Ilaya Street, Tondo, Manila on July 3, 1892.\n The organization derived from La Solidaridad and the Propaganda movement. The purpose of La Liga Filipina was to build a new group that sought to involve the people directly in the reform movement.;;;;La Liga Filipina era una organización secreta. Fue fundada por José Rizal en la casa de Doroteo Ongjunco en la calle Ilaya, Tondo, Manila el 3 de julio de 1892.\n La organización deriva de La Solidaridad y el movimiento Propaganda. El propósito de La Liga Filipina era construir un nuevo grupo que buscara involucrar a la gente directamente en el movimiento de reforma.;;;;;;;;x
EVTOPTA58;Avoid problems and leave the islands;;;;Evitar problemas y dejar las islas;;;;;;;;x
EVTNAME59;Powers Intervention;;;;Intervención de las potencias;;;;;;;;x
EVTDESC59;The Powers show interest in taking control of our country which lies in total destruction and chaos. It seems that the rest of the Powers agree to carry out an organized intervention and seek to begin relations with the leaders of the national rebel groups to carry out joint actions.;;;;Las Potencias muestran interés en tomar el control de nuestro país el cual yace en total destrucción y caos. Parece ser que en resto de Poderes están de acuerdo para realizar una intervención organizada y buscan comenzar relaciones con los líderes de los grupos rebeldes nacionales para realizar acciones conjuntas.;;;;;;;;x
EVTOPTA59;The rebels have contacted a Power;;;;Los rebeldes han contactado con una Potencia;;;;;;;;x
EVTNAME60;A new government;;;;Un nuevo gobierno;;;;;;;;x
EVTDESC60;The previous corrupt and tyrant government has been removed, now we must seek the establishment of a new government that gives us peace and prosperity.;;;;El anterior gobierno corrupto y tirano ha sido removido, ahora debemos buscar el establecimiento de un nuevo gobierno que nos brinde paz y prosperidad.;;;;;;;;x
EVTOPTA60;Request a new way of government;;;;Pedir una nueva forma de gobierno;;;;;;;;x
EVTNAME61;Establish a new government for $FROMCOUNTRY$;;;;Establecer nuevo gobierno para $FROMCOUNTRY$;;;;;;;;x
EVTDESC61;Our vassal is requesting us to establish a new government for them.;;;;Nuestro vasallo nos pide que establezcamos un nuevo gobierno para ellos.;;;;;;;;x
EVTOPTA61;Establish a democracy;;;;Establecer una Democracia;;;;;;;;x
EVTOPTB61;Establish a parliamentary monarchy;;;;Establecer una Monarquía Parlamentaria;;;;;;;;x
EVTOPTC61;Establish a communist government;;;;Establecer un Gobierno Comunista;;;;;;;;x
EVTOPTD61;Establish a fascist government;;;;Establecer un Gobierno Fascista;;;;;;;;x
EVTOPTE61;Establish an appointed governor;;;;Establecer un Virrey;;;;;;;;x
EVTOPTF61;Establish a Republic;;;;Establecer una Republica;;;;;;;;x
EVTNAME63;Chiapas Resolution;;;;La Resolución de Chiapas;;;;;;;;x
EVTDESC63;Chiapas, as former constituent territory of the Guatemalan audience, was invited to join the Mexican Republic. Political elites in the province were torn between returning to Guatemala or federating with Mexico.\n The internal disputes were resolved with the dissolution of the Provisional Supreme Board of Chiapas and the consequent permanence of Chiapas with Mexico on September 14, 1824.;;;;Chiapas, como antiguo territorio constituyente de la audiencia de Guatemala, fue invitada a unirse a la república mexicana. Las élites políticas en la provincia se hallaban divididas entre volver a Guatemala o federarse con México.\n Las disputas internas se resolvieron con la disolución de la Junta Suprema Provisional de Chiapas y la consecuente permanencia chiapaneca en México el 14 de septiembre de 1824.;;;;;;;;x
EVTOPTA63;Vote to join Mexico;;;;Votar a favor de unirse a México;;;;;;;;x
EVTOPTB63;Vote to stay with Guatemala;;;;Votar a favor de Guatemala;;;;;;;;x
EVTNAME64;Morazan Act;;;;Acta de Morazan;;;;;;;;x
EVTDESC64;The liberal-dominated Assembly elected Manuel José Arce as president but he soon turned against his own faction and dissolved the Assembly. San Salvador rose in revolt against federal authority. Honduras and Nicaragua joined the rebellion and Arce was deposed in 1829. The victors led by the Honduran Francisco Morazán took power and Morazán was proclaimed president in 1830.;;;;La Asamblea, dominada por los liberales, eligió a Manuel José Arce como presidente, pero pronto se volvió contra su propia facción y disolvió la Asamblea. San Salvador se rebeló contra la autoridad federal. Honduras y Nicaragua se unieron a la rebelión y Arce fue depuesto en 1829. Los vencedores liderados por el hondureño Francisco Morazán tomaron el poder y Morazán fue proclamado presidente en 1830.;;;;;;;;x
EVTOPTA64;Declare the state of peace and claim Belize;;;;Declarar la paz y reclamar Belice;;;;;;;;x
EVTNAME65;Francisco Morazan is exiled;;;;Francisco Morazan es exiliado;;;;;;;;x
EVTDESC65;The Assembly in 1838 adjourned with the declaration that the provinces were free to rule themselves as the Federal Republic dissolved. In 1839 Morazán was exiled as rebels from Guatemala, Honduras and Nicaragua entered San Salvador, evicting the governing institutions that held the region together.;;;;La Asamblea en 1838 aplazó la sesión con la declaración de que las provincias eran libres de gobernarse a sí mismas cuando la República Federal se disolviera. En 1839 Morazán fue exiliado cuando rebeldes de Guatemala, Honduras y Nicaragua entraron en San Salvador, desalojando a las instituciones gobernantes que mantenían unida a la región.;;;;;;;;x
EVTOPTA65;The church and religion is first;;;;La iglesia y la religión son primero;;;;;;;;x
EVTNAME66;Become Guatemala;;;;Convertirse en Guatemala;;;;;;;;x
EVTDESC66;The dream of a united Central America has died. The other provinces were too concerned about being dominated by Guatemala to realise the sacrifices we had made to keep the union alive. Well no more. We are done with them. Guatemala will find its own destiny.;Le rêve d'une Amérique centrale unie a volé en éclats. Les autres provinces étaient trop inquiètes par une éventuelle domination du Guatemala pour comprendre les sacrifices concédés pour préserver l'union. Eh bien, voilà. On a en fini avec elles. Le Guatemala trouvera son propre destin.;Der Traum eines vereinigten Zentralamerikas ist tot. Die anderen Provinzen waren zu sehr mit der Dominanz Guatemalas beschäftigt, um sich der Opfer gewahr zu werden, die wir zur Beibehaltung der Union gebracht hatten. Jetzt ist es genug. Wir sind fertig mit ihnen. Guatemala wird seine eigenes Schicksal schmieden.;;El sueño de una América Central unida ha muerto. A las demás naciones les preocupaba demasiado la posición dominante de Guatemala como para comprender los sacrificios que hemos tenido que hacer para mantener la unión con vida. Pues se acabó. Que se vayan al Infierno. Guatemala buscará su propio camino.;;;;;;;;x
EVTOPTA66;Dismantle the USCA;;;;Disolver la República de Centroamérica;;;;;;;;x
EVTNAME67;Aprilsko vastanie;Aprilsko vastanie;Aprilsko vastanie;;Aprilsko vastanie;;;;;;;;x
EVTDESC67;The April Uprising was an insurrection organised by the Bulgarians in the Ottoman Empire from April to May 1876, which was brutally suppressed. It indirectly resulted in the re-establishment of Bulgaria in 1878.\n The regular Ottoman Army and irregular bashi-bazouk units brutally suppressed the rebels, resulting in a public outcry in Europe, with many famous intellectuals condemning the atrocities by the Ottomans and supporting the oppressed Bulgarian population.;;;;El Levantamiento de Abril fue una insurrección organizada por los búlgaros en el Imperio Otomano de abril a mayo de 1876, que fue brutalmente reprimida. Indirectamente resultó en el restablecimiento de Bulgaria en 1878.\n El ejército otomano regular y las unidades bashi-bazouk irregulares reprimieron brutalmente a los rebeldes, lo que provocó una protesta pública en Europa, con muchos intelectuales famosos que condenaron las atrocidades de los otomanos y apoyaron la población búlgara oprimida.;;;;;;;;x
EVTOPTA67;The nationalist movement has been unleashed;;;;El movimiento nacionalista se ha desatado;;;;;;;;x
EVTNAME68;Albanian nationalism;;;;Nacionalismo en Albania;;;;;;;;x
EVTDESC68;Historicaly, Albania remained under Ottoman control as part of the province of Rumelia until 1912, with some interruptions during the 18th and 19th century with the establishment of the autonomy Albanian minded lords.\n The first independent Albanian state was founded by the Albanian Declaration of Independence following a short occupation by the Kingdom of Serbia.;;;;Históricamente, Albania permaneció bajo el control otomano como parte de la provincia de Rumelia hasta 1912, con algunas interrupciones durante los siglos XVIII y XIX con el establecimiento de los señores autónomos de mentalidad albanesa.\n El primer estado independiente de Albania fue fundado por la Declaración de Albania de Independencia tras una breve ocupación del Reino de Serbia.;;;;;;;;x
EVTOPTA68;The nationalist movement has been unleashed;;;;El movimiento nacionalista se ha desatado;;;;;;;;x
EVTNAME69;The End of Austria-Hungary;;;;El Final de Austria-Hungría;;;;;;;;x
EVTDESC69;On September 10th of 1919, after the end of the WWI, the Saint-Germain-en-Laye was signed and stablish the end of the Austro-Hungary Empire and setting the new Austrian republic and the end of the Habsburg dynasty.\n Now, we have lost control over Hungary and lost this important war, there is no another option to save our country, long live to Austria.;;;;El 10 de septiembre de 1919, después del final de la Primera Guerra Mundial, se firmó el Saint-Germain-en-Laye y se estableció el fin del Imperio Austro-Hungaro y el establecimiento de la nueva república austriaca y el fin de la dinastía Habsburgo.\n Ahora , hemos perdido el control sobre Hungría y perdido esta importante guerra, no hay otra opción para salvar nuestro país, viva Austria.;;;;;;;;x
EVTOPTA69;Disolve the dual monarchy;;;;Disolver la monarquía dual;;;;;;;;x
EVTNAME98;Kurofune Raikou;Kurofune Raikou;Kurofune Raikou;;Kurofune Raikou;;;;;;;;x
EVTDESC98;Kurofune Raikou, arrival of the black ships, was a diplomatic and military expedition to the Tokugawa Shogunate, involving two separate voyages by warships of the United States Navy which took place during 185354 under the command of Commodore Matthew Calbraith Perry.\n Perry finally reached Uraga at the entrance to Edo Bay in Japan on 8 July 1853. His fleet at this time consisted of four vessels. As he arrived, Perry ordered his ships to steam past Japanese lines towards the capital of Edo, and position their guns towards the town of Uraga. He also fired shots from his 73 cannons, which he claimed was in celebration of the American Independence Day.\n He also presented the Japanese with a white flag and a letter which told them that in case they chose combat, the Americans would necessarily vanquish them.\n Finally, on 31 March, Perry signed the Convention of Kanagawa which opened the ports of Shimoda and Hakodate to American ships, provided for care of shipwrecked sailors, and the establishment of an American consulate in Shimoda.;;;;Kurofune Raikou ó llegada de los barcos negros, fue una expedición diplomática y militar al Shogunato Tokugawa, que incluyó dos viajes separados por buques de guerra de la Armada de los Estados Unidos que tuvieron lugar durante 1853-1854 bajo el mando del comodoro Matthew Calbraith Perry.\n Perry finalmente llegó a Uraga a la entrada de la bahía de Edo en Japón el 8 de julio de 1853. Su flota en ese momento consistía en cuatro barcos. Cuando llegó, Perry ordenó a sus barcos que pasaran por las líneas japonesas hacia la capital de Edo y posicionaran sus armas hacia la ciudad de Uraga. También disparó con sus 73 cañones, que afirmó que era en celebración del Día de la Independencia de Estados Unidos.\n También presentó a los japoneses una bandera blanca y una carta que les decía que en caso de que eligieran el combate, los estadounidenses acabarían ellos.\n Finalmente, el 31 de marzo, Perry firmó el Tratado de Kanagawa que abrió los puertos de Shimoda y Hakodate a los barcos estadounidenses, así como el cuidado de los marineros náufragos y el establecimiento de un consulado estadounidense en Shimoda.;;;;;;;;x
EVTOPTA98;Accept the Treaty of Kanagawa;;;;Acepta el Tratado de Kanagawa;;;;;;;;x
EVTOPTB98;Kick out the barbarians;;;;Expulsar a los barbaros occidentales;;;;;;;;x
EVTNAME101;Japanese Philosophy;;;;Filosofía Japonesa;;;;;;;;x
EVTDESC101;The Tokugawa shogunate has maintained peace on the island for more than two centuries, aided by a strong-arm philosophy, information control, and isolation from the rest of the world.\n Although this has worked all this time, Western countries are getting closer to our borders and show they have better technology and military power than ours. Continuing with the philosophy of the Tokugawa Shogun will generate us a huge risk from the threat of foreigners.\n It is time to decide whether we will continue to support the shogun or not.;;;;El shogunato de Tokugawa ha mantenido la paz en la isla durante más de dos siglos, ayudado con una filosofía de mano dura, control de información y aislamiento respecto al resto del mundo.\n Aunque esto ha funcionado durante todo este tiempo, los países occidentales cada vez se acercan más a nuestras fronteras y muestran poseer mejor tecnología y poder militar que el nuestro. Seguir con la filosofía del shogun de Tokugawa nos generará un enorme riesgo ante la amenaza de los extranjeros.\n Es momento de decidir si seguiremos apoyando al shogun o no.;;;;;;;;x
EVTOPTA101;Change the philosophy;;;;Cambiar de filosofía;;;;;;;;x
EVTOPTB101;Keep the shogunate philosophy;;;;Mantener la filosofía del Shogun;;;;;;;;x
EVTNAME102;Shogunate's philosophy;;;;Filosofía del Shogun;;;;;;;;x
EVTDESC102;Foreign influence threatens to affect the consciousness and stability of our domains, it is necessary to take protective actions and repel those liberal ideas that Westerners profess. We cannot let our great shogunate that has stood for centuries be destroyed by false ideas and mentalities.;;;;La influencia extranjera amenaza con afectar la conciencia y estabilidad de nuestros dominios, es necesario realizar acciones de protección y repeler esas ideas liberales que profesan los occidentales. No podemos dejar que nuestro gran shogunato que se ha mantenido durante siglos sea destruido por falsas ideas y mentalidades.;;;;;;;;x
EVTOPTA102;Keep the shogunate philosophy;;;;Mantener la filosofía del Shogun;;;;;;;;x
EVTNAME103;The Meiji Restoration;La restauration Meiji;Die Meiji-Restoration;;La restauración Meiji;;;;;;;;x
EVTDESC103;Japan is traditionally considered to have been founded by Emperor Jimmu in 660 B.C., and while the Imperial Lineage was still considered unbroken since then, the Imperial Office had, throughout the Edo period, been reduced to a revered and respected but, ultimately, politically powerless institution. By embracing a restoration of Imperial Rule, along with a programme of swift industrial modernization, constitutionalism and economic freedom, Japan might be able to break the fetters placed upon her by the impositions of the Western World.;Selon la tradition, le Japon aurait été fondé par l'empereur Jimmu en 660 avant notre ère et tandis que la lignée impériale était toujours considérée comme ininterrompue, le Bureau impérial avait lui, pendant toute la période Edo, été réduit à une vénérée et respectée institution en définitive politiquement impuissante. Moyennant le rétablissement du règne impérial, ainsi que la mise ne place d'un vaste programme de modernisation industrielle, de constitutionalisme et de liberté économique, le Japon devrait pouvoir rompre les fers que lui a imposé le monde occidental.;Die Gründung Japans wird üblicherweise dem Kaiser Jimmu im Jahr 660 v.Chr. zugeschrieben, und obwohl die kaiserliche Abstammungslinie seitdem ununterbrochen ist, würde das Kaiseramt während der Edo-Zeit kontinuierlich zu einer verehrten und respektierten, aber letztendlich machtlosen politischen Institution reduziert. Durch die Restauration der kaiserlichen Herrschaft im Einklang einem Programm für rasche industrielle Modernisierung, Konstitutionalismus und Gewerbefreiheit könnte Japan die Fesseln sprengen, die ihm von der westlichen Welt angelegt wurden.;;Tradicionalmente, se considera que Japón fue fundado por el emperador Jimmu en el año 660 a. de.C. y, aunque el linaje imperial se considera ininterrumpido desde entonces, a lo largo del período Edo, la función del Emperador fue reducida a una institución venerada y respetada pero carente de poder político. Al adoptar la restauración del gobierno imperial, junto a un programa de rápida modernización industrial, constitucionalismo y libertad económica, Japón puede ser capaz de romper las cadenas de las imposiciones del mundo occidental.;;;;;;;;x
EVTOPTA103;Defend the Shogunate;;;;Defender el Shogunato;;;;;;;;x
EVTNAME104;Ezo Republic;;;;La República de Ezo;;;;;;;;x
EVTDESC104;The Ezo Republic was a short-lived state established in 1869 by a part of the former Tokugawa military on the island of Ezo, now known as Hokkaido. Ezo is notable for being the first government to attempt to institute democracy in Japan, though voting was allowed only to the samurai caste. The Republic of Ezo existed for only 5 months.;;;;La República Ezo fue un estado de corta duración establecido en 1869 por una parte del antiguo ejército Tokugawa en la isla de Ezo, ahora conocida como Hokkaido. Ezo se destaca por ser el primer gobierno en intentar instituir la democracia en Japón, aunque solo se permitía votar a la casta samurái. La República de Ezo existió solo durante 5 meses.;;;;;;;;x
EVTOPTA104;Celebrate elections;;;;Celebrar elecciones;;;;;;;;x
EVTNAME105;Yucatan Independence Declaration;;;;Yucatán se declara independiente;;;;;;;;x
EVTDESC105;The second Republic of Yucatan began in 1841, with its declaration of independence from the Centralist Republic of Mexico. It remained independent for seven years, after which it rejoined to Mexico.\n The federal army of Yucatan, commanded by Captain Santiago Imán, took the city of Valladolid and on February 12, 1840 issued a report, which stated that federalism should be restored as a form of government to combat poverty in the country.\n The act required the reestablishment of the Mexican Constitution of 1824. Six days later, in the presence of troops of the garrison of Merida, Captain Santiago Imán proclaimed the independence of the Yucatecan territory.;;;;La Segunda República de Yucatán comenzó en 1841, con su declaración de independencia de la República Centralista de México. Se mantuvo independiente durante siete años, luego de lo cual se reincorporó a México.\n El ejército federal de Yucatán, comandado por el capitán Santiago Imán, tomó la ciudad de Valladolid y el 12 de febrero de 1840 emitió un informe en el que se decía que se debía restaurar el federalismo como forma de gobierno para combatir la pobreza en el país.\n La demanda requería el restablecimiento de la Constitución mexicana de 1824. Seis días después, en presencia de tropas de la guarnición de Mérida, el capitán Santiago Imán proclamó la independencia de los yucatecos. territorio.;;;;;;;;x
EVTOPTA105;Restore order;;;;Restaurar el orden;;;;;;;;x
EVTNAME106;Rio Grande Independece Declaration;;;;Rio Grande se declara independiente;;;;;;;;x
