EVTNAME91;;;;;;;;;;;;;x
british_colony_purchase_title;British Colony Purchase;;;;Comprar colonias británicas;;;;;;;;x
british_colony_purchase_desc;The british owns some colonies on our dessire road to the pacific coast, we want to take those regions and we need to find a way to do it, money or bullets;;;;Los británicos poseen colonias que obstaculizan nuestra deseada expansión hacia el Pacifico, debemos hacer algo para obtenerlas, ya sea con plata o plomo;;;;;;;;x
true_freedom_title;True Freedom;;;;Verdadera libertad;;;;;;;;x
true_freedom_desc;Even being a country, for years, we had been a puppet state of european countries, they take our resourses, they take our people as slaves and soldiers to fight their wars... it's time to get a true freedom!;;;;Incluso siendo una nación, por años, nosotros hemos sido un estado títere de los europeos, ellos toman nuestros recursos, vuelven esclavos a nuestra gente y nuestros soldados pelean sus guerras… ¡es hora de obtener una verdadera libertad!;;;;;;;;x
rubber_explotation_title;Rubber Explotation;;;;Explotación de caucho;;;;;;;;x
rubber_explotation_desc;With our new position as a free country we need to start to develop our economy, administration and politics, but, the money is first.\n One good thing we learned from the europeans is how to trade with the rubber, and its high value, we need to focus on that resourse as fast as we can;;;;Ahora que somos una nación libre podemos comenzar a desarrollar nuestra economía, administración y política, pero, el dinero es primero.\n Una buena cosa que aprendimos de los europeos es como comerciar y trabajar el caucho además de su alto valor, necesitamos enfocarnos en ese recurso tan rápido como podamos.;;;;;;;;x
new_abyssinia_title;New Abyssinia;;;;Nueva Abyssinia;;;;;;;;x
new_abyssinia_desc;We are now the ruler of the region, we own all ethiopian provinces and we have the reconnaissance of the world as the New Abyssinia;;;;Ahora nosotros dominamos la región, poseemos todas las provincias etíopes y tendremos el reconocimiento del mundo como la Nueva Abyssinia.;;;;;;;;x
african_jewel_eth_title;African Jewel;;;;La Joya de Africa;;;;;;;;x
african_jewel_eth_desc;Our recent educational development has caught the attention of the world and they begin to call us with the title of The Jewel of Africa.\n It seems that we are on the right track and we should reinforce it by applying improvements in this field;;;;Nuestro reciente desarrollo ha atrapado la atención del mundo y comienzan a llamarnos como La Joya de Africa.\n Parece ser que estamos en el camino correcto y debemos reforzarlo aplicando las mejoras descubiertas.;;;;;;;;x
true_african_conference_eth_title;The True African Conference;;;;La Verdadera Conferencia de Africa;;;;;;;;x
true_african_conference_eth_desc;Our rise to Great Power has given us a privileged position before the European powers, therefore, we must establish our rules on our continent and put an end to European rule.\n Let's use our influence and call a Real Conference of African Countries to get rid of European abuse.;;;;Nuestro asenso a Gran Potencia nos ha dado una posición privilegiada ante las potencias europeas, así mismo, debemos establecer nuestra reglas en nuestro continente y ponerle fin al dominio europeo.\n Vamos a usar nuestra influencia y poder para convocar una verdadera conferencia de países africanos y encargarnos del abuso europeo.;;;;;;;;x
form_madagascar_title;Form Madagascar;;;;Forma Madagascar;;;;;;;;x
form_madagascar_desc;We have taken the entire island for ourselves, defeating rival kingdoms and expanding our control from the jungle to the beaches. It is time to establish a new government, a superior and powerful one.;;;;Hemos tomado la isla entera para nosotros, derrotando reinos rivales y expandiendo nuestro control desde la jungla hasta las playas. Es hora de establecer un nuevo gobierno, uno superior y más poderoso.;;;;;;;;x
ranavalonas_will_title;Ranavalona's Will;;;;La voluntad de Ranavalona;;;;;;;;x
ranavalonas_will_desc;Ranavalona I was a sovereign of the Kingdom of Madagascar from 1828 to 1861. She pursued a policy of isolationism and self-sufficiency, reducing economic and political ties with European powers, repelling a French attack on the coastal town of Foulpointe, and taking measure to eradicate the christian movement by member of The London Missionary Society.;;;;Ranavalona I fue la soberana del Reino de Madagascar de 1828 a 1861. Ella buscó una política aislacionista y auto-suficiente, reduciendo los tratados políticos y económicos con las potencias europeas, además de repeler el ataque francés en la ciudad costera de Foulpointe, y tomó medida para erradicar el movimiento cristiano por miembros del London Missionary Society.;;;;;;;;x
conditional_education_title;Conditional education;;;;Educación condicionada;;;;;;;;x
conditional_education_desc;We will not allow to change our traditions for foreign ideologies, but we must adapt to the technological level of the rest of the world, otherwise, our kingdom could be in danger.;;;;Nosotros no vamos a dejar que nuestras tradiciones sean cambiadas por ideologías extranjeras, pero debemos adaptarnos al nivel tecnológico del resto del mundo, de otro modo, nuestro reino estará en peligro.;;;;;;;;x
region_domination_title;Region domination;;;;Dominación de la región;;;;;;;;x
region_domination_desc;We have defeated our historic rival, now the region is ours.;;;;Hemos derrotado a nuestro rival histórico, ahora la región es nuestra.;;;;;;;;x
bornu_lake_crisis_title;Tchad Lake crisis;;;;Crisis del Lago Chad;;;;;;;;x
bornu_lake_crisis_desc;Relations with the Kanem-Bornu Empire are very bad and have generated friction on the border.\nThe Lake Tchad's region is very fertile and of great interest to us, but first we must weaken the Bornu forces within our territory.;;;;Las relaciones con el Imperio de Bornu son muy malas y han generado fricciones en la frontera.\n La región del Lado Chad es muy fértil y de gran interés para nosotros, pero primero debemos debilitar las fuerzas de Bornu en nuestro territorio.;;;;;;;;x
bornu_lake_farm_title;Tchad Lake Farmlands;;;;Agricultura en el Lago Chad;;;;;;;;x
bornu_lake_farm_desc;We have discovered huge fertile areas around our great lake, it is important to take advantage of what nature offers us and establish farms and agriculture in the region.;;;;Hemos descubierto enormes áreas de tierras fértiles alrededor de nuestro gran lago, es importarte tomar ventaja de lo que la naturaleza nos ofrece y establecer cultivos y desarrollar agricultura en la región.;;;;;;;;x
bornu_lake_crisis2_title;Tension raises over Lake Tchad;;;;La tensión se eleva en el Lado Chad;;;;;;;;x
bornu_lake_crisis2_desc;The neighboring Caliphate of Sokoto has committed murder of people of our culture, they seek to take over our country and the fertile region of Lake Tchad. We can't let them take us by surprise and prepare.;;;;El vecino Califato de Sokoto ha cometido el asesinato de nuestra gente, ellos buscan tomar nuestra nación y las tierras del Lado Chad. No podemos dejar que nos tomen por sorpresa.;;;;;;;;x
tanzanian_influence_title;Tanzanian influence;;;;Influencia tanzana;;;;;;;;x
tanzanian_influence_desc;Our unified kingdom is becoming more and more powerful and influential in the region, therefore we must expand our borders and become the most powerful kingdom in Africa.;;;;Nuestro unificado reino cada vez se vuelve más y más poderoso e influyente en la región, por lo tanto debemos expandir nuestras fronteras y convertirnos en el reino más poderoso de África.;;;;;;;;x
zanzibari_history_culture_title; History and Culture of Zanzibar;;;;Historia y cultura de Zanzibar;;;;;;;;x
zanzibari_history_culture_desc;People have lived in Zanzibar for 20,000 years. History properly starts when the islands became a base for traders voyaging between the African Great Lakes, the Somali Peninsula, the Arabian peninsula, Iran, and the Indian subcontinent.;;;;Las personas han vivido en Zanzibar desde hace 20,000 años. La historia oficialmente comienza cuando las islas se volvieron la base de intercambios entre los grandes lagos africanos, la península somalí, la península árabe, Persia e India.;;;;;;;;x
oyo_imperialism_title;Oyo Imperialism;;;;Imperialismo Oyo;;;;;;;;x
oyo_imperialism_desc;Since we are an independent nation, feelings of imperialism have been strengthened, restoring the ancient greatness of our empire is one of our greatest and most important priorities.;;;;Desde que somos una nación independiente, los sentimientos de imperialismo han tomado fuerza, restaurar la antigua grandeza de nuestro imperio es una de nuestras más grandes e importantes prioridades.;;;;;;;;x
bambara_cultures_title;Bambara cultures;;;;Culturas bambaras;;;;;;;;x
bambara_culture_desc;In the 17th century, one of Baramangolo’s descendants, Kaladian Coulibaly founded the kingdom of Ségou. Though it was one of the dominant forces in the region, it never became stable enough to outlast his death. A few decades later, circa 1712, his great-grandson, Mamari Coulibaly, established the Bambara Empire on the very same spot.\n Both animist kingdoms fell, Kaarta, aka. Massina, in 1854 and Ségou, aka. Bambara, following in 1862. They were conquered by the Tukulor cleric al-Hajj Umar Tall, and converted them to Islam.;;;;En el siglo XVII, uno de los descendientes de Baramangolo, Kaladian Coulibay fundó el Reino de Segu. Aun siendo una de las fuerzas dominantes de la región, nunca pudo obtener la estabilidad. Unas décadas después, cerca de 1712, su gran nieto, Mamari Coulibaly, estableció el Imperio Bambara en el mismo punto.\n Ambos reinos antiguos calleron, tanto Kaarta, llamado también Masina, en 1854 así como Segu, llamado también Bambara, en 1862. Fueron conquistados por el clérigo al-Hajj Umar Tall, del Imperio Tuculor, y convertidos al islam.;;;;;;;;x
mali_legacy_title;Mali's legacy;;;;Legado de Mali;;;;;;;;x
mali_legacy_desc;The Mali empire has been the greatest power in the region that has existed, it controlled the entire region up to the western coasts of the continent, but now, our empire is on its way to become even bigger, it is time to create a new history.;;;;El Imperio de Mali ha sido la más grande fuerza que ha existido en la región, controlando la región entera del oeste del continente, pero ahora, nuestro imperio está en camino de volverse incluso más grande, es hora de crear una nueva historia.;;;;;;;;x
west_african_resourses_title;West African resourses;;;;Recursos del oeste africano;;;;;;;;x
west_african_resourses_desc;The continent provides us with an enormous amount of natural resources and food, if we invest a little in developing agriculture and mining, we could help our people a lot.;;;;El continente nos provee enormes cantidades de recursos naturales y alimentos, si invertimos un poco en desarrollo de agricultura y minería, podríamos ayudar mucho a nuestra gente.;;;;;;;;x
exotic_trade_title; Exotic goods trade;;;;Mercado de recursos exóticos;;;;;;;;x
exotic_trade_desc;The rest of the world has observed that in our region there are resources that they do not have, it seems that our land is a place of resources and exotic materials for them. This is a great opportunity to create a global market and obtain wealth, for this we will need a port and ships to help us carry out exchanges.;;;;El resto del mundo ha observado que nuestra región tiene recursos que ellos no tienen, parece que nuestra tierra es hogar de recursos exóticos y materiales para ellos. Esta es una gran oportunidad de crear un mercado global y obtener financiamiento, para esto, necesitamos un puerto y navíos que nos ayuden a proteger nuestro mercado.;;;;;;;;x
tribal_rivalries_title;Tribal rivalries;;;;Rivalidades tribales;;;;;;;;x
tribal_rivalries_desc;Our region is too small for this amount of kingdoms, our culture is superior and more powerful, maybe we can take some actions about this problem.;;;;La región es muy pequeña para tantos reinos, nuestra cultura es superior y más poderosa, tal vez podamos tomar algunas acciones para resolver este problema.;;;;;;;;x
mossi_isolation_title;Mossi isolation;;;;Aislamiento Mossi;;;;;;;;x
mossi_isolation_desc;The oldest of the actual kingdoms in the region.\n By the 18th century, the Mossi kingdoms had increased significantly in terms of economic and military power in the region. Although there were a number of jihad states in the region trying to forcibly spread Islam, namely the Massina Empire and the Sokoto Caliphate, the Mossi kingdoms largely retained their traditional religious and ritual practices.;;;;El más antiguo de los reinos actuales de la región.\n En el siglo XVIII, los reinos Mossi han incrementado significantemente en términos económicos y militares.\n Al tiempo que habían un numero de estados del Jihad en la región intentando expandir el Islam de manera forzada, por ejemplo el Imperio Massina y el Califato de Sokoto, los reinos Mossi han mantenido sus tradiciones religiosas y practicas rituales intactas.;;;;;;;;x
horn_imperialism_title;Horn of Africa empires;;;;Imperio del Cuerno de Africa;;;;;;;;x
horn_imperialism_desc;Our belief is to unify all Somali people under our flag and create a great empire in the Horn of Africa. We now have enough power to begin this holy mission.;;;;Nuestro objetivo es unificar a todos los pueblos somalíes bajo nuestra bandera y crear un gran imperio en el cuerno de África. Nosotros ahora teneos suficiente poder para comenzar esta sagrada misión.;;;;;;;;x
somalian_greatness_title;Somalian greatness;;;;Grandeza Somalí;;;;;;;;x
somalian_greatness_desc;It is time to unify all Somali peoples, tribes and people under our flag. The great Somalia.;;;;Es hora de unificar a todos los pueblos y tribus somalíes bajo nuestra bandera. La gran Somalia;;;;;;;;x
join_arab_union_title;Join Arab Union;;;;Entrar a la Union Arabe;;;;;;;;x
join_arab_union_desc;Due to the great foreign influence over the region, the Arab nations need to unite to repel those Westerners.;;;;Debido a la gran influencia extranjera sobre la región, las naciones árabes necesitan unirse para repeler a esos occidentales.;;;;;;;;x
western_exploration_arab_title;Western exploration in Arabia;;;;Exploración occidental en Arabia;;;;;;;;x
western_exploration_arab_desc;The Great Powers are pressuring us to allow them to explore our region, even though we don't like their culture, we don't have the power to oppose it.;;;;Las grandes potencias están presionándonos para permitirles explorar nuestra región, incluso cuando no nos agrada su cultura, no tenemos el poder para oponernos.;;;;;;;;x
arab_identity_title;Arab identity;;;;Identidad arabe;;;;;;;;x
arab_identity_desc;The cradle of humanity was in our land, the first kingdoms and empires were in Arab land. We cannot allow ourselves to forget that pride, we have to reinforce our culture.;;;;La cuna de la humanidad fue en nuestra tierra, los primeros reinos e imperios fueron en tierra árabe. No podemos permitirnos olvidar ese orgullo, tenemos que reforzar nuestra cultura.;;;;;;;;x
oil_fever_title;Oil fever in Arabia;;;;Fiebre del petroleo en Arabia;;;;;;;;x
egyptian_independence_title;Egyptian independence;;;;Independencia egipcia;;;;;;;;x
egyptian_independence_desc;The history of Egypt under the Muhammad Ali dynasty, 1805-1853, spanned the later period of Ottoman Egypt, the Khedivate of Egypt under British occupation, and the nominally independent Sultanate of Egypt and Kingdom of Egypt, ending with the Revolution of 1952 and the formation of the Republic of Egypt.;;;;La historia de Egipto bajo la dinastía de Muhammad Ali, 1805-1853, caracterizo al periodo final del Egipto otomano, la ocupación británica, y finalmente la independencia del Sultanato de Egipto y el Reino de Egipto, que finalmente terminó en la revolución de 1952 y la formación de la Republica de Egipto.;;;;;;;;x
demand_independence_title;Demand independence;;;;Exigir independencia;;;;;;;;x
demand_independence_desc;The relations between our nation and the emperor are not good, our people seek independence and tension rises, our army is ready to start the battle, but a war will be devastating, it is best to declare independence diplomatically and avoid deaths in vain.;;;;Las relaciones entre nuestra nación y el emperador no son buenas, nuestra gente busca la independencia y las tensiones se elevan, nuestro ejército está listo para la batalla, pero la guerra sería devastadora, por lo tanto lo mejor será declarar la independencia de manera diplomática para evitar muertes en vano.;;;;;;;;x
oil_fever_desc;Our oil fields are numerous and large. Before foreigners take advantage of our land, it is better to invest and obtain the benefit that belongs to us by right.;;;;Nuestros campos petroleros son grandes y numerosos. Antes de que los extranjeros busquen tomar ventaja de nuestra tierra, es mejor que invirtamos y obtengamos el beneficio que nos pertenece por derecho.;;;;;;;;x
blood_river_convention_title;Blood River convention;;;;Convención del Blood River;;;;;;;;x
blood_river_convention_desc;Following the example of the Sand River and Orange River conventions, our nation must make a treaty to obtain international recognition as well as rapprochement with the other Boer nations.;;;;Siguiendo el ejemplo de las convenciones del Sand River y el Orange River, nuestra nación debe hacer un tratado para obtener reconocimiento internacional y también el re-acercamiento con las otras naciones Boer.;;;;;;;;x
boer_alliance_title;Boer Alliance;;;;Alianza Boer;;;;;;;;x
boer_alliance_desc;With the growing threat of the Zulu Empire, the militarily weaker Boer nations must unite to face war together.;;;;Con la creciente amenaza del Imperio Zulú, las militarmente débiles naciones Boer necesitan unirse para enfrentar la guerra juntos.;;;;;;;;x
last_boer_title;The Last Boer;;;;El ultimo Boer;;;;;;;;x
last_boer_desc;With the recent independence of Rhodesia, this becomes the last of the Boer nations, therefore, making a rapprochement with the remaining nations should be a priority.;;;;Con la reciente independencia de Rodesia, esta se convierte en la última de las naciones Boer, así mismo, hacer un acercamiento con las restantes naciones Boer debe ser una prioridad.;;;;;;;;x
zulu_traditions_title;Zulu Tradition;;;;Tradiciones Zulú;;;;;;;;x
zulu_traditions_desc;The traditions of our people must never be forgotten, even with the recent influence of the European Powers, Zulu will remain alive.;;;;Las tradiciones de nuestro pueblo nunca deben ser olvidadas, incluso con la reciente influencia de las potencias europeas, Zulú debe seguir viva.;;;;;;;;x
south_african_farmlands_title;South African farmlands;;;;Africultura Sudafricana;;;;;;;;x
south_african_farmlands_desc;The lands of the South African region are very fertile and provide great potential for settlement and agriculture.\n Taking advantage of regional lands is undoubtedly an option that must be taken;;;;Las tierras de Sudáfrica son muy fértiles y proveen gran potencial para sentamientos y agricultura.\n Tomar ventaja de las tierras regionales es sin duda una opción que debe ser tomada.;;;;;;;;x
the_apart_title;The apartheid;;;;El Apartheid;;;;;;;;x
the_apart_desc;Apartheid  was a system of institutionalised racial segregation that existed in South Africa and South West Africa from 1948 until the early 1990s.\n Apartheid was characterised by an authoritarian political culture based on baasskap, or white supremacy, which ensured that South Africa was dominated politically, socially, and economically by the nation's minority white population.\n Taking this decision will give us benefits with the European Powers but our people could rebel.;;;;El apartheid fue un sistema de segregación racial institucionalizado y que existió en Sudáfrica y el Sudoeste africano desde 1948 hasta la década de 1990.\n Esta se caracterizó por una cultura política autoritaria basada en la supremacía blanca, la cual aseguraba la dominación política sobre África, social y económicamente, por las minorías de población blanca.\n Tomar esta decisión nos dará beneficios con las potencias europeas pero provocará la rebeldía de nuestra gente.;;;;;;;;x
finish_the_apart_title;End the Apartheid;;;;Terminar el Apartheid;;;;;;;;x
finish_the_apart_desc;Between 1987 and 1993, the National Party entered into bilateral negotiations with the African National Congress, the leading anti-apartheid political movement, for ending segregation and introducing majority rule.\n In 1990, prominent ANC figures such as Nelson Mandela were released from prison. Apartheid legislation was repealed on 17 June 1991, pending multiracial elections held under a universal suffrage set for April 1994.;;;;Entre 1987 y 1993, el Partido Nacional entró en negociaciones bilaterales con el Congreso Nacional Africano, lideradas por un movimiento político anti-apartheid, para finalizar la segregación y la introducción de reglas.\n En 1990, prominentes figuras del ANC como Nelson Mandela fueron liberado de prisión. El aparthied fue retirado el 17 de Junio de 1991, y se realizaron elecciones multi-raciales bajo sufragio universal en Abril de 1994.;;;;;;;;x
caucasus_rivalries_title;Caucasus rivalries;;;;Rivalidades del Cáucaso;;;;;;;;x
caucasus_rivalries_desc;With our constant rise we believe that it is time to expand our borders and influence throughout the Caucasus region.;;;;Con nuestro constante ascenso creemos que es hora de expandir nuestras fronteras e influencia a través de la región del Cáucaso.;;;;;;;;x
black_sea_ruler_title;Black Sea ruler;;;;Dueños del Mar Negro;;;;;;;;x
black_sea_ruler_desc;Our new navy and naval ports have given us a large area of control throughout the Black Sea, the rest of the Powers know it.;;;;Nuestra nueva marina y puertos navales nos han dado un enorme control por todo el Mar negro y el resto de potencias lo saben.;;;;;;;;x
anti_persia_league_title;Anti-Persia League;;;;Liga Anti-Persa;;;;;;;;x
anti_persia_league_desc;For centuries the Persian Empire has expanded throughout the region, its power is unmatched and rivals the Ottoman Empire to define who has control of the Middle East, but with the current support of the Russian Empire, we can face the Persian threat.;;;;Por siglos el Imperio Persa se ha expandido a través de la región, su poder es inigualable y rivaliza con el Imperio otomano para definir quién controla el medio oriente, pero con el actual soporte del Imperio Ruso, nosotros podemos enfrentar la amenaza Persa.;;;;;;;;x
regional_competition_title;Regional competition;;;;Competencia regional;;;;;;;;x
regional_competition_desc;The Middle East region has always been a zone of tension between the kingdoms of the region, all with similar military power, the nation that will take control of the region will be the one that gains an advantage over the rest.;;;;La región de medio oriente siempre ha sido una zona de tensión entre las naciones locales, todas con poder militar semejante y la nación que obtenga el control de la región será la que obtenga alguna ventaja sobre el resto.;;;;;;;;x
mid_east_culture_title;Middle East culture;;;;Cultura del medio oriente;;;;;;;;x
mid_east_culture_desc;Our cultures are among the oldest of humanity, forgetting them would be a fatal mistake for the future of our nation.;;;;Nuestras culturas son las más antiguas de la humanidad, olvidarlas sería un error fatal para el futuro de la nación.;;;;;;;;x
ancient_empire_legacy_title;Ancient Persian Empire legacy;;;;Legado del antiguo Imperio Persa;;;;;;;;x
ancient_empire_legacy_desc;Darius the Great, the fourth king of the Achaemenid Empire, ruled over the Persian Empire when it was at its largest, stretching from The Caucasus and West Asia to what was then Macedonia, the Black Sea, Central Asia, and even into Africa including parts of Libya and Egypt.\n It is our turn to create a Persian empire as great and legendary as that of ancient times and for that we must extend our borders towards Europe.;;;;Darío el Grande, el cuarto rey del Imperio aqueménida, gobernó el Imperio persa cuando estaba en su mayor tamaño, que se extendía desde el Cáucaso y Asia occidental hasta lo que entonces era Macedonia, el Mar Negro, Asia Central e incluso África, incluidas partes. de Libia y Egipto.\n Es nuestro turno de crear un imperio persa tan grande y legendario como el de la antigüedad y para ello debemos extender nuestras fronteras hacia Europa.;;;;;;;;x
the_promised_land_title;The Promised Land;;;;La Tierra Prometida;;;;;;;;x
the_promised_land_desc;The Land of Israel, also known as the Holy Land or Palestine, is the birthplace of the Jewish people, the place where the final form of the Hebrew Bible is thought to have been compiled, and the birthplace of Judaism.\n During World War I, the British government publicly committed to create a Jewish National Home and was granted a Mandate to rule Palestine by the League of Nations for this purpose.;;;;La Tierra de Israel, también conocida como Tierra Santa o Palestina, es el lugar de nacimiento del pueblo judío, el lugar donde se cree que se compiló la forma final de la Biblia hebrea y el lugar de nacimiento del judaísmo.\n Durante la Primera Guerra Mundial, el gobierno británico se comprometió públicamente a crear un Hogar Nacional Judío y la Liga de Naciones nos concedió el Mandato de gobernar Palestina para este propósito.;;;;;;;;x
islam_menace_title;Islamic menace;;;;Amenaza islamica;;;;;;;;x
