poland_industrialization_desc;The Polish region is a place of great mineral assets that allow the owner of the land to develop great industrial power. We must invest in developing industry in the Krakow region to prevent the Great Powers from taking advantage of our lack of control.;;;;La región polaca es un lugar de grandes activos minerales que permiten al propietario de la tierra desarrollar un gran poder industrial. Debemos invertir en el desarrollo de la industria en la región de Cracovia para evitar que las grandes potencias se aprovechen de nuestra falta de control.;;;;;;;;x
baltic_prosperity_title;Baltic Sea Prosperity;;;;Prosperidad del Mar Báltico;;;;;;;;x
baltic_prosperity_desc;The Baltic Sea has become a prosperous trade route between the northern countries with the rest of Europe and the world, if we can get a port and a fleet that give us control over the area we could develop our nation.;;;;El Mar Báltico se ha convertido en una próspera ruta comercial entre los países del norte con el resto de Europa y el mundo, si conseguimos un puerto y una flota que nos dé control sobre la zona podríamos desarrollar nuestra nación.;;;;;;;;x
new_world_europe_title;The New World of Europe;;;;El nuevo mundo de Europa;;;;;;;;x
new_world_europe_desc;The Baltic countries have always remained distant and alien to the problems of the rest of Europe, their population is more liberal and their governments are more open to accepting the demands of their population.;;;;Los países bálticos siempre se han mantenido distantes y ajenos a los problemas del resto de Europa, su población es más liberal y sus gobiernos están más abiertos a aceptar las demandas de su población.;;;;;;;;x
tech_support_title;Tech Support;;;;Soporte Tecnológico;;;;;;;;x
tech_support_desc;Our nation is currently going through technological difficulties, we are far behind Western Europe, one option is to ask our allies for technological support.;;;;Nuestra nación atraviesa actualmente dificultades tecnológicas, estamos muy por detrás de Europa Occidental, una opción es pedir apoyo tecnológico a nuestros aliados.;;;;;;;;x
black_sea_jewel_title;Black Sea Jewel;;;;Joya del Mar Negro;;;;;;;;x
black_sea_jewel_desc;Our nation, historically small, has always been a target of interest from the Great Powers, but now we have developed our technology and culture to a level that has guaranteed us the security and the power to have control of our land and our seas.;;;;Nuestra nación, históricamente pequeña, siempre ha sido un objetivo de interés de las Grandes Potencias, pero ahora hemos desarrollado nuestra tecnología y cultura a un nivel que nos ha garantizado la seguridad y el poder para tener el control de nuestra tierra y nuestros mares.;;;;;;;;x
true_ruler_of_slavs_title;The True Ruler of Slavs;;;;El Verdadero Señor de los Eslavos;;;;;;;;x
true_ruler_of_slavs_desc;For centuries, the Slavic peoples have depended on distant Russia for protection from eastern and western threats, now that our nation is independent and powerful, we will take over the region.;;;;Durante siglos, los pueblos eslavos han dependido de la lejana Rusia para protegerse de las amenazas orientales y occidentales, ahora que nuestra nación es independiente y poderosa, nos haremos cargo de la región.;;;;;;;;x
education_reform_rut_title;Education Reform;;;;Reforma Educativa;;;;;;;;x
education_reform_rut_desc;Without more foreign influence, we can develop our culture and nation by ourselves, but the first thing will be an education reform.;;;;Sin más influencia extranjera, podemos desarrollar nuestra cultura y nuestra nación por nosotros mismos, pero lo primero será una reforma educativa.;;;;;;;;x
ruthenia_land_title;Ruthenia's Art and Culture;;;;Arte y Cultura de Rutenia;;;;;;;;x
ruthenia_land_desc;The population still does not feel fully a Ruthenian, that is why we must create a feeling of belonging and nationalism, our culture is rich in history and that is why we must create art that tells our story so that each person feels part of this nation.;;;;La población aún no se siente plenamente rutena, por eso debemos crear un sentimiento de pertenencia y nacionalismo, nuestra cultura es rica en historia y por eso debemos crear arte que cuente nuestra historia para que cada persona se sienta parte de esta nación.;;;;;;;;x
transylvanian_people_title;Transylvanian People;;;;Pueblo de Transilvania;;;;;;;;x
transylvanian_people_desc;With our recent independence, not all the Transylvanian peoples remained within our borders, that is why we must recover them from foreign hands.;;;;Con nuestra reciente independencia, no todos los pueblos de Transilvania permanecieron dentro de nuestras fronteras, por eso debemos recuperarlos de manos extranjeras.;;;;;;;;x
budjak_secesion_title;Budjak Secession;;;;Secesión de Budjak;;;;;;;;x
budjak_secesion_desc;Relations with our protector, Russia, are the best, since our independence they have given us economic, technological and military support. Now to strengthen their control in the region, they are willing to sell us the Budjak region, home to thousands of Romanians.;;;;Las relaciones con nuestro protector, Rusia, son las mejores, desde nuestra independencia nos han brindado apoyo económico, tecnológico y militar. Ahora, para fortalecer su control en la región, están dispuestos a vendernos la región de Budjak, hogar de miles de rumanos.;;;;;;;;x
kyievska_rus_ukr_title;Kyievska Rus;;;;Rus de Kiev;;;;;;;;x
kyievska_rus_ukr_desc;Historically, our ancestors owned the region that is now in the hands of Russia, it is our duty to recover the land that by right belongs to us and is home to thousands of people from our nation.;;;;Históricamente, nuestros antepasados poseían la región que ahora está en manos de Rusia, es nuestro deber recuperar la tierra que por derecho nos pertenece y es el hogar de miles de personas de nuestra nación.;;;;;;;;x
kiev_legacy_title;Kiev Legacy;;;;Legado de Kiev;;;;;;;;x
kiev_legacy_desc;Our people have always been recognized as being one of the strongest in the world, our development was feared by Western Europe and our pride was the most important. It is time to regain that pride and respect with our great anthem, an anthem that represents our glorious people.;;;;Nuestra gente siempre ha sido reconocida como una de las más fuertes del mundo, nuestro desarrollo fue temido por Europa Occidental y nuestro orgullo era lo más importante. Es hora de recuperar ese orgullo y respeto con nuestro gran himno, un himno que representa a nuestro glorioso pueblo.;;;;;;;;x
brothers_in_arms_wal_title;Brothers in Arms for Romania;;;;Hermanos de Armas por Rumania;;;;;;;;x
brothers_in_arms_wal_desc;We are at war for our independence, for a free Romania, and those Ottomans force our brothers to fight, we must make a pact with them so that they will abandon the fight and stand on our side to achieve the unification and liberation of the Romanian peoples.;;;;Estamos en guerra por nuestra independencia, por una Rumanía libre, y esos otomanos obligan a nuestros hermanos a luchar, debemos hacer un pacto con ellos para que abandonen la lucha y se pongan de nuestro lado para lograr la unificación y liberación de los rumanos. pueblos.;;;;;;;;x
brothers_in_arms_mol_title;Brothers in Arms for Romania;;;;Hermanos de Armas por Rumania;;;;;;;;x
brothers_in_arms_mol_desc;We are at war for our independence, for a free Romania, and those Ottomans force our brothers to fight, we must make a pact with them so that they will abandon the fight and stand on our side to achieve the unification and liberation of the Romanian peoples.;;;;Estamos en guerra por nuestra independencia, por una Rumanía libre, y esos otomanos obligan a nuestros hermanos a luchar, debemos hacer un pacto con ellos para que abandonen la lucha y se pongan de nuestro lado para lograr la unificación y liberación de los rumanos. pueblos.;;;;;;;;x
nationalist_movement_of_liberation_title; Nationalist movement of liberation;;;;Movimiento nacionalista de liberación;;;;;;;;x
nationalist_movement_of_liberation_desc;The 'First Serbian Uprising' paved the way for the second uprising of 1815, which eventually turned out in favor of Serbia. The resurgent Serbia eventually rose up as a center for resistance to the Ottomans, actively supporting future liberation movements in neighboring Christian territories, especially Bosnia, Bulgaria, and Macedonia.;;;;El 'Primer alzamiento de Serbia' allanó el camino para el segundo alzamiento de 1815, el cual eventualmente le resultó favorable a Serbia. La Serbia resurgida eventualmente se levantó como un centro para la resistencia a los otomanos, apoyando activamente a los futuros movimientos de liberación en los territorios cristianos vecinos, especialmente en Bosnia, Bulgaria y Macedonia.;;;;;;;;x
treaty_of_berlin_rom_title;Treaty of Berlin 1878;;;;Tratado de Berlín de 1878;;;;;;;;x
treaty_of_berlin_rom_desc;Was signed on 13 July 1878. In the aftermath of the Russian victory against the Ottoman Empire in the Russo-Turkish War of 1877, the major powers restructured the map of the Balkan region.\n The most notable result of the conference was the official recognition of the newly independent states of the Romania, the Serbia and the Montenegro.\n Despite the pleas of the Romanian delegates, Romania was forced to cede southern Bessarabia to the Russian Empire. As a compensation, Romania received Dobruja, including the Danube Delta.;;;;Fue firmado el 13 de julio de 1878. A raíz de la victoria rusa contra el Imperio Otomano en la Guerra Ruso-Turca de 1877, las principales potencias reestructuraron el mapa de la región de los Balcanes.\n El resultado más notable de la conferencia fue el reconocimiento de los nuevos estados independientes de Rumania, Serbia y Montenegro.\n A pesar de las súplicas de los delegados rumanos, Rumania se vio obligada a ceder el sur de Besarabia al Imperio ruso. Como compensación, Rumania recibió Dobruja, incluido el delta del Danubio.;;;;;;;;x
reject_zollverein_title;Reject the Zollverein;;;;Rechazar el Zollverein;;;;;;;;x
reject_zollverein_desc;The Zollverein, or German Customs Union, was a coalition of German states formed to manage tariffs and economic policies within their territories. Organized by the 1833 Zollverein treaties, it formally started on 1 January 1834.\n However, its foundations had been in development from 1818 with the creation of a variety of custom unions among the German states. By 1866, the Zollverein included most of the German states. The foundation of the Zollverein was the first instance in history in which independent states consummated a full economic union without the simultaneous creation of a political federation or union.;;;;Zollverein ó Unión Aduanera Alemana fue una organización de aduanas realizada en 1834 por medio de la cual se suprimieron los aranceles entre los miembros de la Confederación Germánica, a excepción de Austria.\n Varios Estados de la Confederación experimentaron un considerable desarrollo económico a partir de 1815.\n La Unión aduanera promovió la unidad de tarifas aduaneras en un proceso de unificación económica que Austria no pudo impedir a pesar de que controlaba la dirección política de la Confederación.;;;;;;;;x
make_an_anthem_title;Make an Anthem;;;;Crear un Himno;;;;;;;;x
make_an_anthem_desc;After independence most people do not know how to feel, they lack a national identity. A good support would be the creation of a unique anthem.;;;;Después de la independencia, la mayoría de la gente no sabe cómo sentirse, carece de identidad nacional. Un buen apoyo sería la creación de un himno único.;;;;;;;;x
join_commonwealth_title;Join in a commonwealth;;;;Unirse en la Mancomunidad;;;;;;;;x
join_commonwealth_desc;Despite being different nations, we still share a great bond with England, therefore, joining a coalition for military, economic and technological collaboration would be a great step towards true peace and a stable region.;;;;A pesar de ser naciones diferentes, todavía compartimos un gran vínculo con Inglaterra, por lo tanto, unirnos a una coalición de colaboración militar, económica y tecnológica sería un gran paso hacia la verdadera paz y una región estable.;;;;;;;;x
restore_celtics_title;Restore Celtic Learnings;;;;Restaurar Enseñanzas Celtas;;;;;;;;x
restore_celtics_desc;Creating an own and unique identity must be a priority to appease the feelings of reintegration to the UK, so returning to the ancient and religious customs of our people would be a huge step to define our nation.;;;;Crear una identidad propia y única debe ser una prioridad para apaciguar los sentimientos de reintegración al Reino Unido, por lo que volver a las antiguas y religiosas costumbres de nuestro pueblo sería un gran paso para definir nuestra nación.;;;;;;;;x
guayana_colony_title;Expand the Guayana colony;;;;Expandir la colonia de Guyana;;;;;;;;x
guayana_colony_desc;With our great influence over Venezuela, we could force them to sell us part of their territory in order to integrate it into our Guayana colony, in addition to helping them with their economic problem.;;;;Con nuestra gran influencia sobre Venezuela, podríamos obligarlos a vendernos parte de su territorio para integrarlo a nuestra colonia Guayana, además de ayudarlos con su problema económico.;;;;;;;;x
treaty_of_nanking_eng_title;Traty of Nanking;;;;Tratado de Nankín;;;;;;;;x
treaty_of_nanking_eng_desc;The Treaty of Nanking was a peace treaty which ended the First Opium War between the United Kingdom and China on 29 August 1842. It was the first of what the Chinese later called the unequal treaties.\n The Qing government agreed to make Hong Kong Island a crown colony, ceding it to the British Queen, Queen Victoria 'in perpetuity', to provide British traders with a harbour where they could 'careen and refit their ships and keep stores for that purpose'.;;;;El Tratado de Nankín fue un tratado de paz que puso fin a la Primera Guerra del Opio entre el Reino Unido y China el 29 de agosto de 1842. Fue el primero de lo que los chinos llamaron más tarde los tratados desiguales.\n El gobierno de Qing acordó convertir la isla de Hong Kong en una colonia de la corona, cediéndola a la reina británica, la reina Victoria 'a perpetuidad', para proporcionar a los comerciantes británicos un puerto en el que pudieran 'desplazarse y reacondicionar sus barcos y guardar provisiones para ese fin'.;;;;;;;;x
indian_empress_dream_title;Indian Empress Dream;;;;Sueño de la Emperatriz de la India;;;;;;;;x
indian_empress_dream_desc;The nationalistic feeling begins to grow among the population of India, the idea of forming a great nation, as the ancient empires resonates strongly, this idea begins to reach the head of the government.;;;;El sentimiento nacionalista comienza a crecer entre la población de la India, la idea de formar una gran nación, como los antiguos imperios resuena con fuerza, esta idea comienza a llegar al jefe de gobierno.;;;;;;;;x
indian_trade_title;Indian Trade;;;;Comercio Indio;;;;;;;;x
indian_trade_desc;The trade in unique and exotic spices begins to grow, our vast lands and enormous agricultural capacity will allow us to dominate this type of trade.;;;;Comienza a crecer el comercio de especias únicas y exóticas, nuestras vastas tierras y enorme capacidad agrícola nos permitirán dominar este tipo de comercio.;;;;;;;;x
claim_independence_india_title;Claim Independe;;;;Reclamar Independencia;;;;;;;;x
claim_independence_india_desc;The era of British rule over our region is over, it is time to raise our weapons and claim our independence.;;;;La era del dominio británico sobre nuestra región ha terminado, es hora de levantar nuestras armas y reclamar nuestra independencia.;;;;;;;;x
german_tanzania_title;German East Africa;;;;África Oriental Alemana;;;;;;;;x
german_tanzania_desc;In 1884, pursuant to the Berlin Conference, colonies were officially established on the African west coast, often in areas already inhabited by German missionaries and merchants. The following year gunboats were dispatched to East Africa to contest the Sultan of Zanzibar's claims of sovereignty over the mainland in what is today Tanzania. Settlements in modern Guinea and Nigeria's Ondo State failed within a year, those in Cameroon, Namibia, Tanzania and Togo quickly grew into lucrative colonies.;;;;En 1884, de conformidad con la Conferencia de Berlín, se establecieron oficialmente colonias en la costa occidental africana, a menudo en áreas ya habitadas por misioneros y comerciantes alemanes. Al año siguiente, se enviaron cañoneras a África Oriental para impugnar las reclamaciones de soberanía del sultán de Zanzíbar sobre el continente en lo que hoy es Tanzania. Los asentamientos en la Guinea moderna y el estado de Ondo en Nigeria fracasaron en un año, las de Camerún, Namibia, Tanzania y Togo se convirtieron rápidamente en lucrativas colonias.;;;;;;;;x
restore_greeks_title;Restore Greeks Learnings;;;;Restaurar Enseñanzas Griegas;;;;;;;;x
restore_greeks_desc;Our ancient and glorious kingdom has recovered most of its lands, it is time to reinforce the culture and our beliefs in the recovered regions.;;;;Nuestro antiguo y glorioso reino ha recuperado la mayor parte de sus tierras, es hora de reforzar la cultura y nuestras creencias en las regiones recuperadas.;;;;;;;;x
roman_empire_legacy_title;Roman Empire Legacy;;;;Legado del Imperio Romano;;;;;;;;x
roman_empire_legacy_desc;Our mighty empire, now in control of the entire region formerly owned by the Eastern Roman Empire, also known as the Byzantine Empire, is so powerful that the dream of reclaiming even the western area can come true, taking the former center of the Roman Empire, Italy, will be the next step for the restoration of the glory of the empire.;;;;Nuestro poderoso imperio, ahora en control de toda la región que antes era propiedad del Imperio Romano de Oriente, también conocido como Imperio Bizantino, es tan poderoso que el sueño de recuperar incluso el área occidental puede hacerse realidad, tomando el antiguo centro del Imperio Romano, Italia, será el siguiente paso para la restauración de la gloria del imperio.;;;;;;;;x
ottoman_rivalry_title;Ottoman Rivalry;;;;Rivalidad Otomana;;;;;;;;x
ottoman_rivalry_desc;For decades the Ottomans have attacked our empire, wanting to take control of our lands and mock our glory. Now, as the reformed Byzantine Empire, it is our turn to take the initiative and seize their territory and end this rivalry.;;;;Durante décadas, los otomanos han atacado nuestro imperio, queriendo tomar el control de nuestras tierras y burlarse de nuestra gloria. Ahora, como Imperio Bizantino reformado, es nuestro turno de tomar la iniciativa y apoderarse de su territorio y poner fin a esta rivalidad.;;;;;;;;x
egyptian_concessions1_title;Ankara Concession;;;;Concesión de Ankara;;;;;;;;x
egyptian_concessions1_desc;Our autonomous region of Egypt begins to gain a lot of power, we must take advantage of that but also control them, taking the regions closest to the center of our empire will be a good measure.;;;;Nuestra región autónoma de comienza Egipto a ganar mucho poder, debemos aprovechar eso pero también controlarlos, tomar las regiones más cercanas al centro de nuestro imperio será una buena medida.;;;;;;;;x
egyptian_concessions2_title;Syria concession;;;;Concesión de Siria;;;;;;;;x
egyptian_concessions2_desc;Our autonomous region of Egypt begins to gain a lot of power, we must take advantage of that but also control them, taking the regions closest to the center of our empire will be a good measure.;;;;Nuestra región autónoma de comienza Egipto a ganar mucho poder, debemos aprovechar eso pero también controlarlos, tomar las regiones más cercanas al centro de nuestro imperio será una buena medida.;;;;;;;;x
egyptian_concessions3_title;Palestine concession;;;;Concesión de Palestina;;;;;;;;x
egyptian_concessions3_desc;Our autonomous region of Egypt begins to gain a lot of power, we must take advantage of that but also control them, taking the regions closest to the center of our empire will be a good measure.;;;;Nuestra región autónoma de comienza Egipto a ganar mucho poder, debemos aprovechar eso pero también controlarlos, tomar las regiones más cercanas al centro de nuestro imperio será una buena medida.;;;;;;;;x
hedjaz_conquest_title;Conquest of Hedjaz;;;;Conquista de Hiyaz;;;;;;;;x
hedjaz_conquest_desc;The Arabian peninsula begins to be of great interest to the rest of the world, we must take it first.;;;;La península arábiga comienza a ser de gran interés para el resto del mundo, debemos tomarla primero.;;;;;;;;x
the_nordic_model_title;The Nordic Model;;;;El Modelo Nórdico;;;;;;;;x
the_nordic_model_desc;The Nordic model is underpinned by a mixed-market capitalist economic system that features high degrees of private ownership, with the exception of Norway which includes a large number of state-owned enterprises and state ownership in publicly listed firms.\n The Nordic model is described as a system of competitive capitalism combined with a large percentage of the population employed by the public sector.;;;;El modelo nórdico se sustenta en un sistema económico capitalista de mercado mixto que presenta altos grados de propiedad privada, con la excepción de Noruega, que incluye un gran número de empresas estatales y propiedad estatal en empresas que cotizan en bolsa.\n El modelo nórdico es descrito como un sistema de capitalismo competitivo combinado con un gran porcentaje de la población empleada por el sector público.;;;;;;;;x
tnm_embrace_globalization_title;TNM Embrace the Globalization;;;;EMN Reforzar la Globalización;;;;;;;;x
tnm_embrace_globalization_desc;The model includes support for a universalist welfare state aimed specifically at enhancing individual autonomy and promoting social mobility, a corporatist system involving a tripartite arrangement where representatives of labour and employers negotiate wages and labour market policy mediated by the government, and a commitment to private ownership within a market-based mixed economy.;;;;El modelo incluye el apoyo a un estado de bienestar universalista dirigido específicamente a mejorar la autonomía individual y promover la movilidad social, un sistema corporativista que involucra un arreglo tripartito donde representantes de trabajadores y empleadores negocian los salarios y la política del mercado laboral mediada por el gobierno, y un compromiso con la propiedad privada dentro de una economía mixta basada en el mercado.;;;;;;;;x
norway_train_title;Norway Train;;;;Tren Noruego;;;;;;;;x
norway_train_desc;Norway has large reserves of coal and minerals, and with the recent industrial development of the nation, this is starting to be a huge market, but we need infrastructure to be effective.;;;;Noruega tiene grandes reservas de carbón y minerales, y con el reciente desarrollo industrial de la nación, este está comenzando a ser un mercado enorme, pero necesitamos infraestructura para ser eficaz.;;;;;;;;x
white_lands_title;White Lands;;;;Tierras Blancas;;;;;;;;x
white_lands_desc;Since the independence of Finland assimilation efforts have been made but they have not been very effective, we need to take more nationalistic measures to reinforce the Finnish identity of the nation.;;;;Desde la independencia de Finlandia se han realizado esfuerzos de asimilación pero no han sido muy efectivos, necesitamos tomar más medidas nacionalistas para reforzar la identidad finlandesa de la nación.;;;;;;;;x
jon_sigurosson_legacy_title;Jon Sigurosson Legacy;;;;El Legado de Jon Sigurosson;;;;;;;;x
jon_sigurosson_legacy_desc;Desde que Islandia existe, la nacion se ha mantenido lejos de todo problema continental, pero ser neutral en europa es dificil, debemos aplicar las enseñansas del fundador de la nacion para garantizar la prosperidad de la isla.;;;;Desde que Islandia existe, la nación se ha mantenido lejos de todo problema continental, pero ser neutral en Europa es dificil, debemos aplicar las enseñanzas del fundador de la nación para garantizar la prosperidad de la isla.;;;;;;;;x
expand_seas_title;Expand the Seas;;;;Expandir los Mares;;;;;;;;x
expand_seas_desc;The main economic activity of our nation is fishing, so expanding our trade area should be vital for the current economic situation, even so, the English seas are close and could create tension in the area.;;;;La principal actividad económica de nuestra nación es la pesca, por lo que ampliar nuestra zona comercial debería ser vital para la situación económica actual, aun así, los mares ingleses están cerca y podrían crear tensión en la zona.;;;;;;;;x
bears_civilization_title;Bears Civilization;;;;Civilización de Osos;;;;;;;;x
bears_civilization_desc;Incredible, the bears are creating a civilization!;;;;¡Increíble, los osos están creando una civilización!;;;;;;;;x
make_a_good_decision_title;Make a Good Decision;;;;Toma una Buena Decisión;;;;;;;;x
make_a_good_decision_desc;Our country is far from the old world problems but, at the same time,  we have problems in common with other countries of the new world.\n Listening what the people needs its a very good idea, just try to make a good decision after.;;;;Nuestro país está lejos de los problemas del viejo mundo pero, al mismo tiempo, tenemos problemas en común con otros países del nuevo mundo.\n Escuchar las necesidades de la gente es una muy buena idea, solo trata de tomar una buena decisión después.;;;;;;;;x
enact_tratado_de_igualdad_title;Enact Tratado De Igualdad;;;;Establecer Tratado de Igualdad;;;;;;;;x
